{
  "knowledge_base": "Product CGI Prompt Engineering - Master Formula",
  "last_updated": "2026-04-05",
  "source_type": "reference guide (structured)",
  "entries": [
    {
      "category": "Master Prompt Formula",
      "statements": [
        "The fundamental structure for product CGI prompts is: [Product type] in [setting or environment], [camera movement] with [angle], [lighting and mood], [style reference], cinematic, high detail, realistic CGI, product-focused",
        "Example application: Luxury perfume bottle on marble pedestal, camera slowly rotates around product with dramatic side lighting, close-up shot, moody shadows, golden hour style, hyperreal CGI, inspired by Apple ads",
        "Master prompt example: Matte black wireless earbuds floating above a stone pedestal, camera orbiting 360 degrees, dramatic spotlight casting soft shadow on white background, macro angle reveals brand logo, cinematic Apple-style CGI, moody and modern"
      ]
    },
    {
      "category": "Camera Movements for Product CGI",
      "statements": [
        "Orbit / Rotate: Use 'camera rotates 360° around the product' to showcase all angles of the product from a complete circular perspective",
        "Push-in: Use 'slow push-in toward the product' to highlight details and packaging with progressive focus intensification",
        "Pull-out: Use 'camera pulls away to reveal full...' for dramatic reveals and smooth transitions from close-up to wide view",
        "Crane up/down: Use 'crane up from bottom to top of product' to emphasize height or vertical elements of the product",
        "Tilt down/up: Use 'camera tilts down over the product' to reveal branding or unique features on the top surface",
        "Top-down pan: Use 'overhead camera pans slowly across product' for flat-lay or luxury overview presentations",
        "Slide / Track: Use 'camera slides sideways past product' for tech-style sleek motion and profile reveals",
        "Zoom in/out: Use 'camera zooms into product label' to draw focus to logos, text, and fine details",
        "Rotation-in-place: Use 'product rotates while camera is static' for floating or spotlight-focused looks",
        "POV reveal: Use 'POV reaching to grab the product' for lifestyle integration and immersive perspective"
      ]
    },
    {
      "category": "Camera Angles to Pair with CGI Products",
      "statements": [
        "Close-up: Use 'close-up on product texture' to show materials, texture details, and branding elements with magnified clarity",
        "Macro: Use 'extreme close-up of surface' for skin creams, tech finishes, and small details requiring extreme magnification",
        "Medium angle: Use 'eye-level view of product' for balanced, standard advertising looks that feel natural and accessible",
        "Low angle: Use 'low angle to emphasize power' for luxury, bold packaging that conveys strength and prestige",
        "Top-down / Flatlay: Use 'flat lay shot from overhead' for beauty products, packaging reveals, and minimalist compositions",
        "Dutch angle: Use 'tilted angle for creative style' for edgy fashion or conceptual shots requiring visual tension",
        "Backlit silhouette: Use 'backlight with rim light edge' for elegant reveals, perfume bottles, and watches with luminous edges"
      ]
    },
    {
      "category": "Creative CGI Video Ideas",
      "statements": [
        "Floating in Light Box: Product floating mid-air with camera orbiting, spotlight highlights, and black backdrop for dramatic isolation",
        "Cinematic Pouring Effect: Liquid (oil, perfume) pouring in slow-motion with macro angle for viscous, luxurious movement capture",
        "Futuristic Turntable Reveal: Product on rotating base with neon background and reflections on surface for high-tech aesthetic",
        "Nature vs Tech Contrast: Camera slides across product in moss/forest setting versus sleek backdrop for conceptual juxtaposition",
        "Luxury Spa Vibe: Steaming water, marble tiles, smooth tracking over bottle with candlelight mood for premium wellness positioning"
      ]
    },
    {
      "category": "Keywords for CGI Generation - Lighting",
      "statements": [
        "Use 'backlight' for rim-lit silhouettes and edge definition on translucent or reflective products",
        "Use 'soft shadows' for gentle, diffused shadow transitions that enhance form without harsh contrast",
        "Use 'moody lighting' for atmospheric, emotionally evocative illumination with selective highlights",
        "Use 'rim light' for edge-defining light that separates product from background with luminous outlines",
        "Use 'studio spot' for focused, directional light creating dramatic highlights and controlled shadow play",
        "Use 'dramatic contrast' for high-key/low-key lighting ratios that emphasize product dimensionality"
      ]
    },
    {
      "category": "Keywords for CGI Generation - Materials",
      "statements": [
        "Use 'reflective surface' for shiny, mirror-like finishes that capture and bounce light realistically",
        "Use 'chrome' for polished metal with high specularity and mirror-like reflections",
        "Use 'matte black' for non-reflective, absorptive surfaces with deep color saturation",
        "Use 'glassy' for transparent or semi-transparent materials with refractive properties",
        "Use 'brushed aluminum' for directional surface finish with parallel micro-scratches and soft reflections",
        "Use 'velvet' for soft, light-absorbing fabric with minimal specularity and rich color depth",
        "Use 'marble' for natural stone with veining, translucency, and subtle reflective properties"
      ]
    },
    {
      "category": "Keywords for CGI Generation - Effects",
      "statements": [
        "Use 'water droplets' for realistic liquid beads on surfaces with refraction and reflection",
        "Use 'glowing edges' for luminescent rim lighting or self-emissive surface properties",
        "Use 'soft mist' for atmospheric volumetric fog or haze creating depth and mood",
        "Use 'particles in light beam' for visible dust or particle effects illuminated by directional light",
        "Use 'steam' for volumetric vapor effects suggesting warmth or luxury spa environments",
        "Use 'shimmer' for subtle, shimmering surface reflections and light-catching movement"
      ]
    },
    {
      "category": "Keywords for CGI Generation - Style",
      "statements": [
        "Use 'product photography' for professional, polished aesthetic with controlled lighting and composition",
        "Use 'luxury packaging' for premium visual treatment emphasizing exclusivity and high-end positioning",
        "Use 'hyperreal' for photorealistic rendering with meticulous detail and material accuracy",
        "Use 'cinematic CGI' for film-quality production with dramatic lighting and professional color grading",
        "Use 'Apple-style ad' for minimalist, elegant aesthetic with focus on form and premium presentation"
      ]
    },
    {
      "category": "Keywords for CGI Generation - Backgrounds",
      "statements": [
        "Use 'white studio backdrop' for clean, professional isolation allowing product to be the sole focus",
        "Use 'black void' for dramatic, high-contrast isolation with luminous product definition",
        "Use 'nature-inspired set' for organic, environmental context suggesting natural positioning",
        "Use 'modern shelf' for contemporary retail or display context with minimalist staging",
        "Use 'floating scene' for weightless, surreal environment suggesting premium, ethereal positioning"
      ]
    },
    {
      "category": "30+ Camera Movements for Prompts",
      "statements": [
        "Pan left/right: Use 'camera pans left' or 'camera pans right' for horizontal sweeping motion across the product",
        "Tilt up/down: Use 'camera tilts up' or 'camera tilts down' for vertical sweeping motion revealing vertical product elements",
        "Dolly in/out: Use 'camera dollies in slowly' or 'camera dollies out dramatically' for forward/backward movement with perspective shift",
        "Crane up/down: Use 'camera cranes up from ground level' or 'camera cranes down from sky view' for elevated perspective changes",
        "Push-in: Use 'camera pushes in slowly toward subject's face' for progressive focus intensification toward product details",
        "Pull-out: Use 'camera pulls out to reveal landscape' for context expansion from close-up to environmental view",
        "Tracking shot: Use 'camera tracks behind the subject walking' for following motion parallel to product movement",
        "Orbit shot: Use 'camera orbits around the subject in 360' for complete circular perspective of stationary product",
        "Handheld: Use 'handheld camera shakes gently, raw documentary style' for organic, naturalistic movement",
        "POV: Use 'POV shot from character's eyes' for first-person immersive product interaction perspective",
        "Zoom in/out: Use 'zoom in on expression' or 'zoom out to wide view' for optical magnification without physical camera movement",
        "Dutch angle: Use 'slight dutch angle for unease' for tilted frame creating visual tension or creative dynamism",
        "Static shot: Use 'static wide angle shot' for motionless camera capturing complete environmental context",
        "Steadicam: Use 'smooth steadicam following subject' for fluid, stabilized motion following product movement",
        "Time-lapse: Use 'time-lapse of sunset over cityscape' for compressed temporal progression showing environmental changes",
        "Slow motion: Use 'slow motion raindrops hitting pavement' for extended temporal expansion emphasizing motion details",
        "Rack focus: Use 'camera rack focuses from flower to face' for selective focus transition between foreground and subject",